Ссылка на канал;Название канала;Описание канала;Общее количество просмотров;Количество подписчиков;Количество видеороликов;Дата создания канала;Страна;Доступность канала;Ключевые слова;Модерация комментариев;Дата загрузки последного видеоролика
https://www.youtube.com/channel/UCAlJn7Rm8TgbPPGEhxKXuXw;Беременность Роды Материнство;Канал «Беременность Роды Материнство» создан для семьи, которая только думает завести ребенка, ждет его...;894352;5097;16;2016-08-09T18:33:03.000Z;None;public;Беременность Роды Материнство;None;2018-08-06T16:02:37.000Z
https://www.youtube.com/channel/UCwVdR_GO58_5H3mbOOdXF_g;Aleksandra P.;Привет всем, кто заходит на мой канал!:) Я совсем недавно решила начать записывать видеоролики касающиеся...;200110;338;16;2013-03-09T10:40:34.000Z;None;public;None;None;2018-07-19T14:35:32.000Z
https://www.youtube.com/channel/UCIFJn7e7pCVF6IX0QfA1bUA;OLANT;Привет! Дорогие умные мамы и папы! Олант поможет вам сориентироваться в мире детских товаров, и выбрать...;2691441;14959;632;2013-08-08T16:38:07.000Z;RU;public;"""Беременность по неделям"" материнство ""подготовка к родам"" роды ""беременность видео"" коляска ""грудное вскармливание"" новорожденный ""путешествие с ребенком.""";None;2018-11-13T13:58:29.000Z
https://www.youtube.com/channel/UCiwFvp4umxmQJP0dvdjxMHA;Анастасия Васильева;;7915;40;42;2013-05-06T17:36:36.000Z;None;public;молодая мама;None;2018-11-16T09:22:58.000Z
https://www.youtube.com/channel/UC434FvlDcdHhiCdhqwaUW1Q;Евгений Мелешко;;272289;208;58;2014-03-04T19:36:54.000Z;None;public;None;None;2014-03-16T12:47:35.000Z
https://www.youtube.com/channel/UC-AdIk1mKUi9L_IehHbI5_Q;KATE VASILEK;Всем привет, меня зовут Катя, я молодая мама прекрасной девочки Алисы(8.10.2015)=;311261;687;5;2016-11-28T19:00:53.000Z;RU;public;"роды беременность ""уход за детьми"" ""мои роды"" ""1год ребенку"" ""развитие ребенка"" ""развитие ребенка по месяцам"" ""молодая мама"" ""влог мамы"" ""обзор кометики"" ""обзор покупок"" ""покупки для детей"" ""воспитание детей"" рецепты";None;2016-12-13T07:48:47.000Z
https://www.youtube.com/channel/UCdipfQHO6eA-J01ua-3GTQw;ДЕТИ в РАДОСТЬ;ДЕТИ В РАДОСТЬ.РУ- все о детях: планирование беременности, зачатие, беременность и роды, лечение, питание...;12996;0;10;2016-09-06T11:12:57.000Z;RU;public;"""планирование беременности"" зачатие ""беременность и роды"" уход лечение питание ""развитие ребенка"" заболевания ""как лечить"" симптомы болезнь";None;2018-11-10T01:25:28.000Z
https://www.youtube.com/channel/UCDZ36t3Nb4tUWOGtwCk6kfg;Ждем-Малыша;"Канал блога и интернет-магазина ""ЖДЕМ-МАЛЫША.РФ"". Всё о беременности и родах, забавных детях, а также другие...";545042;1382;64;2014-06-08T10:31:52.000Z;None;public;"""ждем малыша"" дети беременность";None;2015-05-08T13:36:31.000Z
https://www.youtube.com/channel/UC6rnZkHXw0O_utwZQ1A5nLw;ПапаРаПапа;Всем привет! Я — будущий отец, и мне очень интересно родительство и всё, что с этим связано. Мужской взгляд...;12822;276;3;2016-07-15T15:21:51.000Z;None;public;материнство дети воспитание беременность роды семья психология обзор список;None;2016-08-12T14:51:20.000Z
https://www.youtube.com/channel/UCSc3XtLzP_kvIeJ9YpBxeAg;Канал Светланы Солнцевой;;20946;162;152;2015-08-17T11:16:02.000Z;None;public;None;None;2018-11-13T15:00:03.000Z
https://www.youtube.com/channel/UC_O7Z7SmbeoSqqxYFs0eDcg;Екатерина Токарева;Добро пожаловать на канал Екатерины Токаревой! Екатерина Токарева - телеведущая, актриса и героиня Календа...;22103;443;9;2016-01-21T16:31:22.000Z;RU;public;"""Екатерина Токарева"" ""fashion fashionvlog"" ""спорт и беременность"" здоровье ""буду мамой"" крастота ""бьюти блогер"" ""фешн блогер"" бьютиблог ""беременность роды"" ""40 недель"" дети ребенок ""дневник беременной""";None;2018-05-27T11:43:14.000Z
https://www.youtube.com/channel/UC_bbeOtkk9EcaPQ7_zSgn7w;Моя счастливая беременность;;2227;23;3;2014-12-03T13:28:44.000Z;None;public;None;None;2016-03-17T06:28:08.000Z
https://www.youtube.com/channel/UC_wjSfRPjpo-oJXi6LDkxjQ;Профессор Самчук Петр Михайлович;Этот канал создан для того, чтобы помочь сделать вашу беременность легкой и благополучной. «В акушерстве...;19703;211;50;2015-06-08T17:39:08.000Z;RU;public;"беременность роды ""беременность и роды"" материнство ""стану мамой что нужно знать"" ""петр самчук"" самчук ""самчук петр"" ""самчук петр михайлович"" ""петр михайлович самчук"" ""доктор самчук"" профессор ""профессор самчук"" ""врач самчук"" акушер гинеколог акушер-гинеколог кесарево сечение эксперт ""естественные роды"" ""школа материнства"" ""подготовка к беременности""";None;2018-07-07T19:34:14.000Z
https://www.youtube.com/channel/UCEkZ-XYT44gihuRNsKLLqaw;Павел Моднов;;1425158;4779;6;2013-01-06T11:29:32.000Z;None;public;None;None;2018-08-05T03:34:12.000Z
https://www.youtube.com/channel/UCaPh3WcraxihMJ2VTNb7wrg;WOWBODY mom;Wowbody MOM - это твой гид по здоровой и красивой беременности. Вся необходимая информация - в одной программе!...;34531;797;7;2017-09-18T07:38:43.000Z;None;public;None;None;2018-11-10T10:00:00.000Z
https://www.youtube.com/channel/UCG9k7Vy0-J5MI2EgFsDm0SQ;jWoman Ru Женский Онлайн Журнал;jWoman.Ru - Онлайн Журнал о Материнстве. Узнайте больше о здоровье, питании и спорте при беременности. Присоедин...;138711;344;1;2016-09-22T12:55:39.000Z;None;public;беременность зачатие ребенок триместр недели здоровье воспитание;None;2018-07-12T15:13:27.000Z
https://www.youtube.com/channel/UCSV_-dShTQaKbdc3vBFz18w;Света Шенгелия;Всем привет! Меня зовут Света. Я - самостоятельная мама трех парней. А еще я - детский и семейный фотограф,...;141979;344;11;2015-05-09T19:31:31.000Z;RU;public;Эмма_Майер Вязание Дети Фотография;None;2017-05-19T13:07:31.000Z
https://www.youtube.com/channel/UCgm5r0J1WdtrkDD3E21CzNA;Подтвержденная Страница;Данная отметка означает, что страница была подтверждена администрацией ВКонтакте VK: https://vk.com/approvedpage.;842297;3227;39;2015-07-13T18:21:47.000Z;None;public;None;None;2018-11-10T19:32:58.000Z
https://www.youtube.com/channel/UCk5unq01DSwoQ5IlLu8vHUw;Baby Boom-story;Мы рады приветствовать вас на нашем видео портале BabyBoomStory, который был создан для того что бы дать максималь...;313254;902;2;2016-11-08T08:24:51.000Z;None;public;None;None;2017-01-17T08:53:14.000Z
https://www.youtube.com/channel/UCa9f1eKAkKQIPSz4EZCU-Bg;Мама Многодетная;;7648;11;1;2016-07-16T06:55:27.000Z;None;public;None;None;2016-07-16T11:38:27.000Z
https://www.youtube.com/channel/UCFK7ZrQD1KLwibTCZisDbFg;Dariana;Провести время с чашечкой кофе, отбросив все проблемы и неурядицы - присоединяйся ко мне!;548208;2700;132;2010-12-24T12:15:47.000Z;RU;public;влог беременность роды окситоцин материнство москва ясенево россия;None;2018-11-07T12:31:42.000Z
https://www.youtube.com/channel/UCqaLh2lZQAEtEWAiADh5ghQ;Любовь Дайнеко;Всем привет!) Меня зовут Люба, мне 22 года. Снимаю для Вас видео из своей жизни, рассказываю полезные советы,...;5147;14;17;2016-07-10T10:51:52.000Z;RU;public;None;None;2018-09-19T15:58:16.000Z
https://www.youtube.com/channel/UCdf9wsSmjiXZ3y2pNmDXO3A;глеб глебыч;;200;0;2;2018-09-20T15:16:35.000Z;None;public;None;None;2018-09-23T14:50:12.000Z
https://www.youtube.com/channel/UCNHpD4w_-0w5Si_p8wGYcuA;Елена Леонтьева;Помогаем женщинам обрести счастье материнства. Даже в самых трудных случаях.;53602;786;156;2009-12-24T03:07:16.000Z;RU;public;"""подготовка к зачатию"" ""подготовка к родам"" беременность роды ""как забеременеть"" ""как стать мамой"" материнство бесплодие ""хочу ребенка"" ""осознанное материнство"" ""как я стала мамой"" ""как я преодолела бесплодие"" ""преодолеть бесплодие"" ""как я забеременела"" забеременеть ""быть мамой"" ""елена леонтьева"" зачатие";None;2018-11-01T10:22:57.000Z
https://www.youtube.com/channel/UC9-HW02wGyEq2R2ZWTHd9dQ;Мамин Труд;Мамин Труд - Для начинающих и продолжающих матерей :);101974;61;17;2014-02-26T09:00:04.000Z;None;public;None;None;2014-03-13T17:01:07.000Z
https://www.youtube.com/channel/UCLco85vxqcl5EEOtMx1QwJw;Самый юный блогер;Детский канал Канал самого юного блогера Софии, который она ведет с помощью своего самого лучшего папы...;614;16;9;2018-07-17T22:55:21.000Z;RU;public;Детский развлекательный канал;None;2018-10-13T15:45:43.000Z
https://www.youtube.com/channel/UCULRmbMwiKHVpfMUyhCGfLQ;Мамы Крыма;Портал о беременности и родах мам Крыма.;1554;3;41;2016-04-11T06:25:14.000Z;None;public;None;None;2016-05-20T07:16:45.000Z
https://www.youtube.com/channel/UCqkv68iCjLo5sYx3upAu-Gw;Natalie Nevedrova;Салют! Меня зовут Натали Неведрова. (NEVEDROVA) Я продюсер, телеведущая, лицо канала Ю и dj. Присоединяйтесь, если...;3408914;6264;94;2011-04-02T16:15:07.000Z;RU;public;"""Натали Неведрова"" ""орел и решка"" selfmade";None;2018-11-08T09:59:40.000Z
https://www.youtube.com/channel/UCbuY8Nd9vDcaiUK2OFAMf2g;Профессор Камиль Бахтияров;Профессор Камиль Бахтияров, акушер-гинеколог, профессор, доктор медицинских наук, врач высшей категории,...;116456;1334;28;2015-11-25T10:36:34.000Z;RU;public;"гинеколог ""акушер гинеколог"" здоровье бесплодие беременность";None;2018-11-09T05:51:25.000Z
https://www.youtube.com/channel/UCUrme74gDKJkg2DJ42LeRmA;Арина Скоромная. Фитнес мама. Фитнес мотиватор.;Обзоры продуктов красоты и здоровья, тренировки, восстановление после родов, ЗОЖ, правильное питание, спорт...;68497;6843;21;2012-11-10T13:51:40.000Z;RU;public;"""Арина Скоромная"" ""Арина Варская"" ""фитинес мама"" фитнес ""правильное питание"" ""спортивное питание"" фитнес-тренер диетолог-нутрициолог ЗОЖ ""здоровый образ жизни"" ""обзоры продуктов красоты"" ""секреты красоты и здоровья"" ""эффективное жиросжигание"" тренировки ""восстановление после родов"" ""антицеллюлитный комплекс""";None;2018-11-15T13:20:18.000Z
https://www.youtube.com/channel/UCgzpwFtQH8ijwXk9t8uZVEg;Silvia Sahakyan;Всем привет! Меня зовут Сильвия и добро пожаловать на канал о красоте. психологии, здоровом образе жизни...;18410796;282341;160;2014-01-09T21:01:49.000Z;RU;public;веган психология iherb beauty бьюти косметика похудеть вегетарианство прыщи волосы уход красота;True;2018-11-14T09:00:05.000Z
https://www.youtube.com/channel/UCiNBi5kEnuK3Rhjq964Dg2Q;Марина Счастливая;Данный канал посвящен теме красоты, здорового образа жизни, домашним фитнес тренеровкам и уходу за собой.;533;10;3;2016-05-26T08:55:59.000Z;None;public;Фитнес и красота;None;2018-11-01T11:18:47.000Z
https://www.youtube.com/channel/UCM0lrw5B3iV9P3IeOjaw15g;Юля Yst;Приветствую тебя на своём канале❗   Тут будут собраны все яркие моменты нашей жизни ! . А так же: #беремен...;271678;2083;213;2015-08-11T18:52:19.000Z;RU;public;обзор aliexpress лайфхак той терьер бьюти распаковка влог блог секси эротика угар прикол смешное видео vine beauty беременность ребенок малыш новорожденный любовь отношения рецепт;None;2018-11-14T20:28:40.000Z
https://www.youtube.com/channel/UCTJW3pprYHB2d-B33Tg1myA;vesna2727;То, что сердцу моему отзовется.;569793;549;37;2009-12-03T02:51:12.000Z;US;public;None;None;2018-07-12T04:31:01.000Z
https://www.youtube.com/channel/UCh_c9LaxZaOmFTnd2D8mUPw;Наши любимые детки;Добро пожаловать всем, кто любит детей! Здоровье, питание, воспитание, образование, консультации специалис...;266797;422;65;2014-10-28T09:30:54.000Z;None;public;"Дети воспитание обучение питание одежда ""игры и игрушки""";None;2015-11-06T15:55:46.000Z
https://www.youtube.com/channel/UC2QbYSWfuCuDHxrRPRjXdog;Dawg;Аниме = духовное разложение. Что-то трудно началось.;18789731;325520;23;2017-02-08T18:09:55.000Z;None;public;None;None;2018-06-10T12:24:55.000Z
https://www.youtube.com/channel/UCCqf6pmmidUwoznnCAlmP1w;Mama-Jane. Интернет магазин одежда для беременных и кормящих мам.;;8625;4;11;2015-05-05T14:54:43.000Z;None;public;Интернет магазин одежда для беременных и кормящих мам;None;2016-05-21T15:43:02.000Z
https://www.youtube.com/channel/UCO4xJ_R4CTVsBaVyC93N8YA;Аечка мамочка;Я молодая мамочка и рассказываю о материнстве и беременности.;10;0;1;2015-03-28T08:55:03.000Z;None;public;Беременность и материнство;None;2018-01-13T16:26:17.000Z
https://www.youtube.com/channel/UC5CvLM51G3H7Ryo4tYJAXCw;Ольга Боярищева;Здравтсвуйте! Меня зовут Ольга, и это канал о моей жизни, и всем остальном что мне нравится.;9209;32;2;2012-10-27T15:55:36.000Z;None;public;None;None;2018-11-13T16:22:37.000Z
https://www.youtube.com/channel/UCN7UiUGGiD68L_S_ztXpaCg;Кир и Кристина Григорьян;Привет! Мы живем и работаем в Китае 1 год, ждём первого ребёнка, радуемся жизни и любим нашего Господа! Если...;12641;209;17;2013-07-27T18:29:35.000Z;RU;public;None;None;2018-10-27T17:53:47.000Z
https://www.youtube.com/channel/UCSypapADUHtNDtPeH2VoYbw;Молитвы Православные;Многие задают вопрос: почему ролики 40 раз? ... 40 - число сакральное 40 недель беременность, числа: 10ть, 20ть,...;7435007;39941;41;2016-09-16T02:44:19.000Z;RU;public;"""православные молитвы"" ""молитва ребенок"" ""молитва перед"" ""сильный молитва"" ""молитва помощь"" ""молитвы православные"" ""молитва святой"" ""молитва жизнь"" ""молитва здравие"" ""молитва пресвятой богородица"" ""молитва душа"" ""православные молитвы слушать"" ""православные молитвы от порчи"" ""утренняя молитва православная"" ""христианский молитва"" псалом ""сильные православные молитвы"" ""православная молитва от сглаза"" ""молитва от сглаза и порчи православная"" ""православная молитва перед"" ""отче наш"" ""псалом 90""";None;2018-03-28T01:40:55.000Z
https://www.youtube.com/channel/UCBB-fuytH93ri691QBZj9sA;joochean;koketka.by - интересный портал для женщин. Тут можно найти много интересного и полезного.;5255235;3696;45;2010-03-07T11:56:08.000Z;None;public;None;None;2013-04-16T19:59:39.000Z
https://www.youtube.com/channel/UCVfQ8FrpFRLVtmPNbPoSPPA;Ekaterina Saibel;Привет, друзья. Добро пожаловать на наш канал, мы каждому очень рады. Мы – семья Сайбель, наша фамилия не...;498696255;1152231;1108;2012-05-26T16:23:51.000Z;KZ;public;Сайбель мама;None;2018-11-15T12:17:46.000Z
https://www.youtube.com/channel/UCfetWtbo8oq_FnkHRgK9h0g;Экономная #хаусменеддер;Говорят, что денег никогда не хватает. Это не правда. Правда, что потребности всегда опережают возможности....;1647242;6021;13;2014-06-03T04:39:45.000Z;None;public;"беременность роды материнство ""воспитание детей"" ""уход за телом"" ""маски для лица""";None;2015-03-03T05:23:47.000Z
https://www.youtube.com/channel/UC0Nf87BPyN-HKnIqFwCAeSQ;Пусть говорят;;896;5;2;2015-02-08T13:34:27.000Z;None;public;None;None;2015-02-08T19:01:39.000Z
https://www.youtube.com/channel/UCj1Lit4I0VLmnyJAg3JK2xg;МамаЙога Онлайн;Во время практики мы совершаем увлекательное путешествие внутрь себя, развиваем качество контакта с собой,...;264146;5459;16;2015-08-13T01:16:33.000Z;None;public;"""йога для беременных"" ""восстановление после родов"" ""гимнастика для беременных""";None;2018-07-23T03:37:48.000Z
https://www.youtube.com/channel/UCKnMPXr5WtDsgGJvaGvxX8Q;супер свинка майнкрафта!!!;Всем привет меня зовут Саша и на моем канале будут разные видео про фнаф,майнкрафт... Спасибо за лайки.;177;12;4;2017-06-17T12:33:21.000Z;None;public;None;None;2017-07-03T06:29:46.000Z
https://www.youtube.com/channel/UCcr4xibwEN_blSHwuyggmpg;Анастасия К;;221;1;2;2010-02-19T13:53:50.000Z;None;public;None;None;2018-08-30T21:16:24.000Z
https://www.youtube.com/channel/UCVA89pX17FXTliyjC3YqXQA;la.mansh;Всем привет! Я вас очень рада видеть на своем канале! Меня зовут Вероника и я живу в Беларуси. Мода, красота,...;760884;3044;23;2013-01-28T15:30:54.000Z;None;public;None;None;2014-09-03T12:29:34.000Z
https://www.youtube.com/channel/UC6oBc7EUvevKwKe3QdEi-UA;HerandBaby;Her And Baby - это канал, который предоставляет информацию беременным женщинам, которые беременны, и которые...;1729670;0;33;2012-11-09T09:39:49.000Z;RU;public;"herandbaby овуляция ""первые признаки беременности"" ""тест на беременность"" ""календарь беременности"" ""pregnancy test at home"" pregnancy pregnant ""how to make pregnancy test""";None;2018-10-17T14:00:46.000Z
https://www.youtube.com/channel/UC_3Zud21lFQzJTv6RqtMYFg;ZenShen;Это страничка Ксении, инструктора по йоге в прошлом, психолога, преподавателя английского, жены, мамы. Мне...;5547;16;111;2011-03-07T20:27:31.000Z;None;public;None;None;2018-09-10T07:28:12.000Z
https://www.youtube.com/channel/UCoZ2EeZBNMEVmB3WRmo2PXg;FRAUTESTru;FRAUTEST (ФРАУТЕСТ) - тесты быстрой диагностики. Под брендом ФРАУТЕСТ продаются в аптеках тесты на овуляцию,...;2236923;2349;13;2010-04-20T10:20:27.000Z;None;public;"""тесты на беременность"" ""тесты на овуляцию"" беременность овуляция фраутест frautest менопауза";None;2013-11-14T09:53:48.000Z
https://www.youtube.com/channel/UC8KU61imRy43MlvoOe_v0UQ;Per Biechl;Женский клуб Империя мам.;442323;391;40;2014-05-04T07:22:50.000Z;None;public;None;None;2018-05-12T12:30:41.000Z
https://www.youtube.com/channel/UCPM_BmgwgcRLKMahUdWMytg;Дхарма Женщины;Мир не изменится пока не изменятся женщины: женщины рожают и слабых рабов с неблагопритяной кармой и сильны...;16343;170;31;2015-11-28T12:56:23.000Z;None;public;Дхарма Женщины;None;2016-02-25T17:24:54.000Z
https://www.youtube.com/channel/UCpm6vCgiehSKHtMFFS5ukiA;Katy LifeVlog;Всем привет! Мы рады вас видеть на нашем канале, где мы снимаем влоги! Мне 24 года и Ване 25, живем в Испании...;547019382;2183276;1901;2012-08-08T18:37:57.000Z;RU;public;"""Катя и Ваня"" ""Sweet Home"" ""Katy Life Vlog"" Makeupkaty ""Ежедневные влоги"" ""влоги каждый день"" влоги";None;2018-11-16T02:30:02.000Z
https://www.youtube.com/channel/UC9uC0khTipAJMCgftHmUkpQ;Семья ТВ;"""Семья.ТВ"" — это семья в объективе о семье и семейных ценностях ! Дети: развитие, обучение, образование. Хоро...";3808389;24485;622;2011-04-03T19:32:24.000Z;RU;public;"""развитие ребенка"" ""дошкольное развитие"" ""развитие детей дошкольного возраста"" ""развитие деятельности детей"" ""психическое развитие"" ""раннее развитие детей"" ""воспитание детей"" ""ребенок родитель"" ""семья ребенок"" ""психология ребенок"" ""ребенок развитие"" ""образование детей"" ""дошкольное образование детей"" ""образование детей дошкольного возраста""";None;2018-11-15T06:24:17.000Z
https://www.youtube.com/channel/UC4Fr7lHHOsNSHUq_Ol3bCcw;Maryana Ro;iHOLA! Я МАРЬЯНА, МНЕ 16 (⁄ ⁄•⁄ω⁄•⁄ ⁄) ЛЮБЛЮ СНИМАТЬ ВИДЕО ПРО ВСЯКУЮ ЧУШЬ КОТОРАЯ ПРОИСХОДИТ СО МНОЙ ВОТ...;1312;33;34;2016-10-08T07:13:51.000Z;None;public;None;None;2017-03-24T17:30:14.000Z
https://www.youtube.com/channel/UCk0NTrK1BZSl-0hdhhM8-tg;Двойня com;;1857;2;1;2014-01-26T13:08:22.000Z;None;public;None;None;2017-04-08T10:14:36.000Z
https://www.youtube.com/channel/UCGGNaSr7_CSrW6DJ1YqSeoQ;Светлана и Денис Мельниковы;;30427;130;141;2012-07-22T20:12:19.000Z;None;public;None;None;2018-11-01T08:56:59.000Z
